{
  "title": "<Your Topic> Learning Plan",
  "description": "Phase ordering and estimated durations. Add phases to match your concepts.json.",
  "total_duration": "TBD",
  "phases": [
    {
      "id": "phase_1",
      "title": "Foundations",
      "duration_weeks": "2–4",
      "order": 1,
      "prerequisites": []
    }
  ]
}
